headline,label,score,raw_label,source,published,link
US telcos Q3 2025: Mobile carriers bundles and deals analysis,neutral,0.920157,Neutral,,"Fri, 07 Nov 2025 18:47:08 +0000",https://www.verdict.co.uk/carriers-smartphone-promotions-analysis/?.tsrc=rss
I’m Watching For This Upcoming IPO After The Company Replaced Chinese Manufacturing,neutral,0.929254,Neutral,,"Fri, 07 Nov 2025 18:18:03 +0000",https://247wallst.com/investing/2025/11/07/im-watching-for-this-upcoming-ipo-after-the-company-replaced-chinese-manufacturing/?.tsrc=rss
Warren Buffett vs. Michael Saylor: Who Made the Better Investment This Quarter,neutral,0.838349,Neutral,,"Fri, 07 Nov 2025 18:14:09 +0000",https://247wallst.com/investing/2025/11/07/warren-buffett-vs-michael-saylor-who-made-the-better-investment-this-quarter/?.tsrc=rss
"Nvidia Hits $5 Trillion, But Can It Survive Without China?",neutral,0.849199,Neutral,,"Fri, 07 Nov 2025 18:09:54 +0000",https://finance.yahoo.com/news/nvidia-hits-5-trillion-survive-180954378.html?.tsrc=rss
MP Materials Stock Jumps After Earnings. Why the Market ‘Has It Wrong’ on Rare Earths.,negative,0.646040,Negative,,"Fri, 07 Nov 2025 17:56:00 +0000",https://finance.yahoo.com/m/0997093b-a327-389e-b7d2-ee8b7ca367e4/mp-materials-stock-jumps.html?.tsrc=rss
Should Rachel Reeves increase taxes on expensive homes? How readers voted,neutral,0.907320,Neutral,,"Fri, 07 Nov 2025 16:19:33 +0000",https://uk.finance.yahoo.com/news/rachel-reeves-taxes-expensive-homes-budget-poll-results-161933538.html?.tsrc=rss
"Top Funds Gobble Up These 4 Stocks — And Nibble On Nvidia, Palantir",neutral,0.817138,Neutral,,"Fri, 07 Nov 2025 16:16:58 +0000",https://finance.yahoo.com/m/408d75ce-e56c-30f4-9469-27536e0c1f39/top-funds-gobble-up-these-4.html?.tsrc=rss
Microsoft Eyes Longest Selloff Since 2011 as AI Trade Weakens,negative,0.962947,Negative,,"Fri, 07 Nov 2025 16:06:52 +0000",https://finance.yahoo.com/news/microsoft-eyes-longest-selloff-since-160652630.html?.tsrc=rss
"Alcoa, Ball and Unilever unveil ELYSIS zero-carbon smelted aerosol can",neutral,0.836802,Neutral,,"Fri, 07 Nov 2025 15:39:21 +0000",https://www.packaging-gateway.com/news/alcoa-ball-unilever-unveil-elysis/?.tsrc=rss
"Magnificent Seven Stocks: Nvidia, Tesla, Amazon, Meta Sell Off",neutral,0.890892,Neutral,,"Fri, 07 Nov 2025 15:23:44 +0000",https://finance.yahoo.com/m/4205eaa9-f620-3a0b-a81a-0e82c7c9fd0b/magnificent-seven-stocks%3A.html?.tsrc=rss
"This Dancing Elephant Stomps All Magnificent 7 Stocks Except Google, Even Eclipsing Nvidia",neutral,0.818541,Neutral,,"Fri, 07 Nov 2025 14:44:03 +0000",https://finance.yahoo.com/m/933cba75-9a24-33cc-b4ae-b55d69c1676d/this-dancing-elephant-stomps.html?.tsrc=rss
Nvidia-Like Gains: This Quantum Computing ETF Could Deliver Multibagger Returns,positive,0.879089,Positive,,"Fri, 07 Nov 2025 14:34:18 +0000",https://247wallst.com/investing/2025/11/07/nvidia-like-gains-this-quantum-computing-etf-could-deliver-multibagger-returns/?.tsrc=rss
Taiwan's Export Boom Ignites as AI Gold Rush Lifts Global Chip Demand,positive,0.787218,Positive,,"Fri, 07 Nov 2025 14:12:05 +0000",https://finance.yahoo.com/news/taiwans-export-boom-ignites-ai-141205189.html?.tsrc=rss
Apple Warns EU Rules Could Make iPhones Less Safe,negative,0.959178,Negative,,"Fri, 07 Nov 2025 13:08:08 +0000",https://finance.yahoo.com/news/apple-warns-eu-rules-could-130808937.html?.tsrc=rss
Cloud AI Update - Atlas Compute Powers AI Growth With New Florida Data Center,positive,0.615672,Positive,,"Fri, 07 Nov 2025 12:38:01 +0000",https://finance.yahoo.com/news/cloud-ai-atlas-compute-powers-123801334.html?.tsrc=rss
"Apple iPhone 17 Sales Soar in India, Fueling Market Momentum",positive,0.941387,Positive,,"Fri, 07 Nov 2025 12:30:14 +0000",https://finance.yahoo.com/news/apple-iphone-17-sales-soar-123014689.html?.tsrc=rss
Tesla Stock: 6 Warning Signs Every Investor Should Know,neutral,0.878110,Neutral,,"Fri, 07 Nov 2025 11:03:08 +0000",https://finance.yahoo.com/news/tesla-stock-6-warning-signs-110308296.html?.tsrc=rss
The Stock Market Has Only Done This 4 Times This Century. Is Warren Buffett Getting Nervous?,neutral,0.615866,Neutral,,"Fri, 07 Nov 2025 10:10:00 +0000",https://www.fool.com/investing/2025/11/07/the-stock-market-has-only-done-this-4-times-this-c/?.tsrc=rss
MP Materials Corp (MP) Q3 2025 Earnings Call Highlights: Record Production and Strategic ...,positive,0.902357,Positive,,"Fri, 07 Nov 2025 09:01:16 +0000",https://finance.yahoo.com/news/mp-materials-corp-mp-q3-090116222.html?.tsrc=rss
Inside Corning’s Bold Bid to Revive the U.S. Solar Industry,positive,0.772654,Positive,,"Fri, 07 Nov 2025 09:00:00 +0000",https://finance.yahoo.com/m/cccb6318-7b06-3a63-901f-310ad6af3978/inside-corning%E2%80%99s-bold-bid-to.html?.tsrc=rss
